{
  "$schema": "https://json-schema.org/draft/2020-12/schema",
  "$id": "https://eidetic-engine/schemas/ee.mesh.policy_decision.v1.json",
  "title": "ee.mesh.policy_decision.v1",
  "description": "Structured, redaction-safe authorization decision surface for optional mesh memory policy checks.",
  "type": "object",
  "required": [
    "schema",
    "direction",
    "action",
    "reason",
    "policyRef",
    "materialLane",
    "redaction",
    "trustLane",
    "failure"
  ],
  "additionalProperties": false,
  "properties": {
    "schema": {
      "type": "string",
      "const": "ee.mesh.policy_decision.v1"
    },
    "direction": {
      "type": "string",
      "enum": ["inbound", "outbound"]
    },
    "action": {
      "type": "string",
      "enum": ["allow", "deny", "quarantine", "reject"]
    },
    "reason": {
      "type": "string",
      "minLength": 1,
      "maxLength": 160,
      "pattern": "^[a-z0-9_:-]+$"
    },
    "policyRef": {
      "description": "Either the literal missing-policy sentinel or a redaction-safe policy alias. Raw path-like policy IDs must be hashed before they reach this field.",
      "type": "string",
      "pattern": "^(missing|[A-Za-z0-9._:-]{6,160})$"
    },
    "materialLane": {
      "type": "string",
      "enum": ["metadata", "body", "embedding", "graphLink", "revisionNotice", "curationSignal"]
    },
    "redaction": {
      "type": "string",
      "enum": ["share", "redact", "deny"]
    },
    "trustLane": {
      "type": ["string", "null"],
      "enum": ["localHuman", "peerHumanViaPeer", "peerAgent", "peerDerived", "untrusted", null]
    },
    "importTrustClass": {
      "type": ["string", "null"],
      "enum": ["agent_validated", "agent_assertion", null]
    },
    "bodyFetchAllowed": {
      "type": "boolean"
    },
    "localTruthSideEffectsAllowed": {
      "type": "boolean"
    },
    "searchOrGraphSideEffectsAllowed": {
      "type": "boolean"
    },
    "payloadExportAllowed": {
      "type": "boolean"
    },
    "rawPayloadExportAllowed": {
      "type": "boolean"
    },
    "redactedPayloadRequired": {
      "type": "boolean"
    },
    "failure": {
      "anyOf": [
        {
          "type": "null"
        },
        {
          "$ref": "ee.mesh.policy_failure_surface.v1.json"
        }
      ]
    }
  },
  "allOf": [
    {
      "if": {
        "properties": {
          "direction": { "const": "inbound" }
        }
      },
      "then": {
        "required": [
          "importTrustClass",
          "bodyFetchAllowed",
          "localTruthSideEffectsAllowed",
          "searchOrGraphSideEffectsAllowed"
        ],
        "not": {
          "anyOf": [
            { "required": ["payloadExportAllowed"] },
            { "required": ["rawPayloadExportAllowed"] },
            { "required": ["redactedPayloadRequired"] }
          ]
        }
      }
    },
    {
      "if": {
        "properties": {
          "direction": { "const": "outbound" }
        }
      },
      "then": {
        "required": ["payloadExportAllowed", "rawPayloadExportAllowed", "redactedPayloadRequired"],
        "not": {
          "anyOf": [
            { "required": ["importTrustClass"] },
            { "required": ["bodyFetchAllowed"] },
            { "required": ["localTruthSideEffectsAllowed"] },
            { "required": ["searchOrGraphSideEffectsAllowed"] }
          ]
        }
      }
    },
    {
      "if": {
        "properties": {
          "direction": { "const": "inbound" },
          "action": { "const": "allow" },
          "materialLane": { "const": "body" }
        },
        "required": ["direction", "action", "materialLane"]
      },
      "then": {
        "required": ["bodyFetchAllowed", "failure"],
        "properties": {
          "bodyFetchAllowed": { "const": true },
          "failure": { "type": "null" }
        }
      }
    },
    {
      "if": {
        "properties": {
          "direction": { "const": "outbound" },
          "action": { "const": "allow" },
          "materialLane": { "const": "body" },
          "redaction": { "const": "redact" }
        },
        "required": ["direction", "action", "materialLane", "redaction"]
      },
      "then": {
        "required": [
          "payloadExportAllowed",
          "rawPayloadExportAllowed",
          "redactedPayloadRequired",
          "failure"
        ],
        "properties": {
          "payloadExportAllowed": { "const": true },
          "rawPayloadExportAllowed": { "const": false },
          "redactedPayloadRequired": { "const": true },
          "failure": { "type": "null" }
        }
      }
    },
    {
      "if": {
        "properties": {
          "direction": { "const": "outbound" },
          "action": { "const": "allow" },
          "materialLane": { "const": "embedding" },
          "redaction": { "const": "redact" }
        },
        "required": ["direction", "action", "materialLane", "redaction"]
      },
      "then": {
        "required": [
          "payloadExportAllowed",
          "rawPayloadExportAllowed",
          "redactedPayloadRequired",
          "failure"
        ],
        "properties": {
          "payloadExportAllowed": { "const": true },
          "rawPayloadExportAllowed": { "const": false },
          "redactedPayloadRequired": { "const": true },
          "failure": { "type": "null" }
        }
      }
    },
    {
      "if": {
        "properties": {
          "direction": { "const": "outbound" },
          "action": { "const": "allow" },
          "materialLane": { "const": "body" },
          "redaction": { "const": "share" }
        },
        "required": ["direction", "action", "materialLane", "redaction"]
      },
      "then": {
        "required": [
          "payloadExportAllowed",
          "rawPayloadExportAllowed",
          "redactedPayloadRequired",
          "failure"
        ],
        "properties": {
          "payloadExportAllowed": { "const": true },
          "rawPayloadExportAllowed": { "const": true },
          "redactedPayloadRequired": { "const": false },
          "failure": { "type": "null" }
        }
      }
    },
    {
      "if": {
        "properties": {
          "direction": { "const": "outbound" },
          "action": { "const": "allow" },
          "materialLane": { "const": "embedding" },
          "redaction": { "const": "share" }
        },
        "required": ["direction", "action", "materialLane", "redaction"]
      },
      "then": {
        "required": [
          "payloadExportAllowed",
          "rawPayloadExportAllowed",
          "redactedPayloadRequired",
          "failure"
        ],
        "properties": {
          "payloadExportAllowed": { "const": true },
          "rawPayloadExportAllowed": { "const": true },
          "redactedPayloadRequired": { "const": false },
          "failure": { "type": "null" }
        }
      }
    },
    {
      "if": {
        "properties": {
          "direction": { "const": "outbound" },
          "action": { "const": "allow" },
          "materialLane": { "const": "metadata" },
          "redaction": { "const": "share" }
        },
        "required": ["direction", "action", "materialLane", "redaction"]
      },
      "then": {
        "required": [
          "payloadExportAllowed",
          "rawPayloadExportAllowed",
          "redactedPayloadRequired",
          "failure"
        ],
        "properties": {
          "payloadExportAllowed": { "const": true },
          "rawPayloadExportAllowed": { "const": true },
          "redactedPayloadRequired": { "const": false },
          "failure": { "type": "null" }
        }
      }
    },
    {
      "if": {
        "properties": {
          "direction": { "const": "outbound" },
          "action": { "const": "allow" },
          "materialLane": { "const": "revisionNotice" },
          "redaction": { "const": "share" }
        },
        "required": ["direction", "action", "materialLane", "redaction"]
      },
      "then": {
        "required": [
          "payloadExportAllowed",
          "rawPayloadExportAllowed",
          "redactedPayloadRequired",
          "failure"
        ],
        "properties": {
          "payloadExportAllowed": { "const": true },
          "rawPayloadExportAllowed": { "const": true },
          "redactedPayloadRequired": { "const": false },
          "failure": { "type": "null" }
        }
      }
    },
    {
      "if": {
        "properties": {
          "action": { "const": "allow" }
        },
        "required": ["action"]
      },
      "then": {
        "required": ["failure"],
        "properties": {
          "failure": { "type": "null" }
        }
      }
    },
    {
      "if": {
        "properties": {
          "action": { "enum": ["deny", "quarantine", "reject"] }
        },
        "required": ["action"]
      },
      "then": {
        "required": ["failure"],
        "properties": {
          "failure": { "$ref": "ee.mesh.policy_failure_surface.v1.json" }
        }
      }
    },
    {
      "if": {
        "properties": {
          "direction": { "const": "inbound" },
          "action": { "enum": ["deny", "quarantine", "reject"] }
        },
        "required": ["direction", "action"]
      },
      "then": {
        "required": [
          "bodyFetchAllowed",
          "localTruthSideEffectsAllowed",
          "searchOrGraphSideEffectsAllowed"
        ],
        "properties": {
          "bodyFetchAllowed": { "const": false },
          "localTruthSideEffectsAllowed": { "const": false },
          "searchOrGraphSideEffectsAllowed": { "const": false }
        }
      }
    },
    {
      "if": {
        "properties": {
          "direction": { "const": "outbound" },
          "action": { "enum": ["deny", "quarantine", "reject"] }
        },
        "required": ["direction", "action"]
      },
      "then": {
        "required": ["payloadExportAllowed", "rawPayloadExportAllowed"],
        "properties": {
          "payloadExportAllowed": { "const": false },
          "rawPayloadExportAllowed": { "const": false }
        }
      }
    },
    {
      "if": {
        "properties": {
          "direction": { "const": "inbound" },
          "action": { "const": "allow" }
        },
        "required": ["direction", "action"]
      },
      "then": {
        "required": ["importTrustClass"],
        "properties": {
          "importTrustClass": {
            "enum": ["agent_validated", "agent_assertion"]
          }
        }
      }
    },
    {
      "if": {
        "properties": {
          "action": { "const": "allow" }
        },
        "required": ["action"]
      },
      "then": {
        "required": ["trustLane"],
        "properties": {
          "trustLane": {
            "enum": ["peerHumanViaPeer", "peerAgent", "peerDerived", "untrusted"]
          }
        }
      }
    },
    {
      "if": {
        "properties": {
          "direction": { "const": "inbound" },
          "action": { "const": "allow" },
          "materialLane": {
            "enum": ["metadata", "embedding", "graphLink", "revisionNotice", "curationSignal"]
          }
        },
        "required": ["direction", "action", "materialLane"]
      },
      "then": {
        "required": ["bodyFetchAllowed"],
        "properties": {
          "bodyFetchAllowed": { "const": false }
        }
      }
    },
    {
      "if": {
        "properties": {
          "action": { "const": "allow" }
        },
        "required": ["action"]
      },
      "then": {
        "required": ["policyRef"],
        "properties": {
          "policyRef": {
            "not": { "const": "missing" }
          }
        }
      }
    },
    {
      "if": {
        "properties": {
          "action": { "const": "allow" }
        },
        "required": ["action"]
      },
      "then": {
        "required": ["redaction"],
        "properties": {
          "redaction": {
            "enum": ["share", "redact"]
          }
        }
      }
    },
    {
      "if": {
        "properties": {
          "direction": { "const": "inbound" },
          "action": { "const": "allow" }
        },
        "required": ["direction", "action"]
      },
      "then": {
        "required": ["localTruthSideEffectsAllowed", "searchOrGraphSideEffectsAllowed"],
        "properties": {
          "localTruthSideEffectsAllowed": { "const": true },
          "searchOrGraphSideEffectsAllowed": { "const": true }
        }
      }
    },
    {
      "if": {
        "properties": {
          "direction": { "const": "outbound" },
          "action": { "const": "allow" },
          "redaction": { "const": "share" }
        },
        "required": ["direction", "action", "redaction"]
      },
      "then": {
        "required": [
          "payloadExportAllowed",
          "rawPayloadExportAllowed",
          "redactedPayloadRequired",
          "failure"
        ],
        "properties": {
          "payloadExportAllowed": { "const": true },
          "rawPayloadExportAllowed": { "const": true },
          "redactedPayloadRequired": { "const": false },
          "failure": { "type": "null" }
        }
      }
    },
    {
      "if": {
        "properties": {
          "direction": { "const": "outbound" },
          "action": { "const": "allow" },
          "redaction": { "const": "redact" }
        },
        "required": ["direction", "action", "redaction"]
      },
      "then": {
        "required": [
          "payloadExportAllowed",
          "rawPayloadExportAllowed",
          "redactedPayloadRequired",
          "failure"
        ],
        "properties": {
          "payloadExportAllowed": { "const": true },
          "rawPayloadExportAllowed": { "const": false },
          "redactedPayloadRequired": { "const": true },
          "failure": { "type": "null" }
        }
      }
    },
    {
      "if": {
        "properties": {
          "direction": { "const": "outbound" },
          "redaction": { "const": "redact" }
        },
        "required": ["direction", "redaction"]
      },
      "then": {
        "required": ["redactedPayloadRequired"],
        "properties": {
          "redactedPayloadRequired": { "const": true }
        }
      }
    },
    {
      "if": {
        "properties": {
          "direction": { "const": "inbound" },
          "action": { "const": "allow" }
        },
        "required": ["direction", "action"]
      },
      "then": {
        "required": ["trustLane"],
        "properties": {
          "trustLane": {
            "enum": ["peerHumanViaPeer", "peerAgent", "peerDerived", "untrusted"]
          }
        }
      }
    }
  ]
}
