{
  "schema": "ee.mesh.policy_decision.v1",
  "direction": "outbound",
  "action": "allow",
  "reason": "outbound_lane_allowed",
  "policyRef": "pol_alpha_mesh_policy",
  "materialLane": "metadata",
  "redaction": "share",
  "trustLane": "peerAgent",
  "payloadExportAllowed": true,
  "rawPayloadExportAllowed": true,
  "redactedPayloadRequired": false,
  "failure": null
}
