{
  "schema": "ee.mesh.policy_decision.v1",
  "direction": "inbound",
  "action": "allow",
  "reason": "peer_policy_lane_allowed",
  "policyRef": "pol_alpha_mesh_policy",
  "materialLane": "body",
  "redaction": "share",
  "trustLane": "peerAgent",
  "importTrustClass": "agent_validated",
  "bodyFetchAllowed": true,
  "localTruthSideEffectsAllowed": true,
  "searchOrGraphSideEffectsAllowed": true,
  "failure": null
}
